{
  "$schema": "http://json-schema.org/draft-07/schema#",
  "title": "BrainGridAgent",
  "type": "object",
  "required": ["id", "name", "role", "boundaries", "outputs"],
  "properties": {
    "id": { "type": "string" },
    "name": { "type": "string" },
    "role": { "type": "string" },
    "boundaries": { "type": "array", "items": { "type": "string" } },
    "inputs": { "type": "array", "items": { "type": "string" } },
    "outputs": { "type": "array", "items": { "type": "string" } },
    "tone": { "type": "string" }
  }
}
